csse-iot@raspberrypi:~ $ lsusb
Bus 001 Device 008: ID 4c4a:4155 Jieli Technology UACDemoV1.0
Bus 001 Device 005: ID 4c4a:4155 Jieli Technology UACDemoV1.0
Bus 001 Device 004: ID 08bb:2902 Texas Instruments PCM2902 Audio Codec
Bus 001 Device 003: ID 0424:ec00 Microchip Technology, Inc. (formerly SMSC) SMSC9512/9514 Fast Ethernet Adapter
Bus 001 Device 002: ID 0424:9514 Microchip Technology, Inc. (formerly SMSC) SMC9514 Hub
Bus 001 Device 001: ID 1d6b:0002 Linux Foundation 2.0 root hub
csse-iot@raspberrypi:~ $ usb-devices

T:  Bus=01 Lev=00 Prnt=00 Port=00 Cnt=00 Dev#=  1 Spd=480 MxCh= 1
D:  Ver= 2.00 Cls=09(hub  ) Sub=00 Prot=01 MxPS=64 #Cfgs=  1
P:  Vendor=1d6b ProdID=0002 Rev=06.01
S:  Manufacturer=Linux 6.1.21-v7+ dwc_otg_hcd
S:  Product=DWC OTG Controller
S:  SerialNumber=3f980000.usb
C:  #Ifs= 1 Cfg#= 1 Atr=e0 MxPwr=0mA
I:  If#=0x0 Alt= 0 #EPs= 1 Cls=09(hub  ) Sub=00 Prot=00 Driver=hub

T:  Bus=01 Lev=01 Prnt=01 Port=00 Cnt=01 Dev#=  2 Spd=480 MxCh= 5
D:  Ver= 2.00 Cls=09(hub  ) Sub=00 Prot=02 MxPS=64 #Cfgs=  1
P:  Vendor=0424 ProdID=9514 Rev=02.00
C:  #Ifs= 1 Cfg#= 1 Atr=e0 MxPwr=2mA
I:  If#=0x0 Alt= 1 #EPs= 1 Cls=09(hub  ) Sub=00 Prot=02 Driver=hub

T:  Bus=01 Lev=02 Prnt=02 Port=00 Cnt=01 Dev#=  3 Spd=480 MxCh= 0
D:  Ver= 2.00 Cls=ff(vend.) Sub=00 Prot=01 MxPS=64 #Cfgs=  1
P:  Vendor=0424 ProdID=ec00 Rev=02.00
C:  #Ifs= 1 Cfg#= 1 Atr=e0 MxPwr=2mA
I:  If#=0x0 Alt= 0 #EPs= 3 Cls=ff(vend.) Sub=00 Prot=ff Driver=smsc95xx

T:  Bus=01 Lev=02 Prnt=02 Port=01 Cnt=02 Dev#=  4 Spd=12  MxCh= 0
D:  Ver= 1.10 Cls=00(>ifc ) Sub=00 Prot=00 MxPS= 8 #Cfgs=  1
P:  Vendor=08bb ProdID=2902 Rev=01.00
S:  Manufacturer=C-Media Electronics Inc.      
S:  Product=USB PnP Sound Device
C:  #Ifs= 3 Cfg#= 1 Atr=80 MxPwr=100mA
I:  If#=0x0 Alt= 0 #EPs= 0 Cls=01(audio) Sub=01 Prot=00 Driver=snd-usb-audio
I:  If#=0x1 Alt= 0 #EPs= 0 Cls=01(audio) Sub=02 Prot=00 Driver=snd-usb-audio
I:  If#=0x2 Alt= 0 #EPs= 1 Cls=03(HID  ) Sub=00 Prot=00 Driver=usbhid

T:  Bus=01 Lev=02 Prnt=02 Port=02 Cnt=03 Dev#=  5 Spd=12  MxCh= 0
D:  Ver= 1.10 Cls=00(>ifc ) Sub=00 Prot=00 MxPS=64 #Cfgs=  1
P:  Vendor=4c4a ProdID=4155 Rev=01.00
S:  Manufacturer=Jieli Technology
S:  Product=UACDemoV1.0
S:  SerialNumber=1120040808090204
C:  #Ifs= 3 Cfg#= 1 Atr=80 MxPwr=100mA
I:  If#=0x0 Alt= 0 #EPs= 0 Cls=01(audio) Sub=01 Prot=00 Driver=snd-usb-audio
I:  If#=0x1 Alt= 0 #EPs= 0 Cls=01(audio) Sub=02 Prot=00 Driver=snd-usb-audio
I:  If#=0x2 Alt= 0 #EPs= 1 Cls=03(HID  ) Sub=00 Prot=00 Driver=usbhid

T:  Bus=01 Lev=02 Prnt=02 Port=04 Cnt=04 Dev#=  8 Spd=12  MxCh= 0
D:  Ver= 1.10 Cls=00(>ifc ) Sub=00 Prot=00 MxPS=64 #Cfgs=  1
P:  Vendor=4c4a ProdID=4155 Rev=01.00
S:  Manufacturer=Jieli Technology
S:  Product=UACDemoV1.0
S:  SerialNumber=1120040808090204
C:  #Ifs= 3 Cfg#= 1 Atr=80 MxPwr=100mA
I:  If#=0x0 Alt= 0 #EPs= 0 Cls=01(audio) Sub=01 Prot=00 Driver=snd-usb-audio
I:  If#=0x1 Alt= 0 #EPs= 0 Cls=01(audio) Sub=02 Prot=00 Driver=snd-usb-audio
I:  If#=0x2 Alt= 0 #EPs= 1 Cls=03(HID  ) Sub=00 Prot=00 Driver=usbhid
csse-iot@raspberrypi:~ $ 


sudo nano /etc/udev/rules.d/99-usb-audio.rules

SUBSYSTEM=="sound", ATTRS{idVendor}=="08bb", ATTRS{idProduct}=="2902", KERNEL=="card*", SYMLINK+="mic_card"

sudo nano /etc/modprobe.d/alsa-base.conf


options snd-usb-audio index=2,3 vid=0x4c4a pid=0x4155

cat /proc/asound/cards
